{
  "schema_version": "mechanism-registry-seed/v0",
  "scope": "unsealed_local_code_test_study",
  "status_ceiling": "experimental",
  "source_study": "docs/local-mechanism-study-v0.md",
  "promotion_requires": ["sealed_source_snapshot", "inventory_mapping", "server_evidence_seal", "formal_mechanism_batch_validation"],
  "mechanisms": [
    {"mechanism_id":"MECH-EVT-001","public_name":"committed-visible batch ledger","proposed_status":"experimental","maturity_ceiling":"M2_candidate","study_locator":"docs/local-mechanism-study-v0.md#mech-evt-001","proposed_evidence_kinds":["code","test","commit"],"pending_formal_fields":["inventory_item_ids","immutable_evidence","runtime_trace"],"known_drift_ids":["DRIFT-PUBLIC-EXPORT-004"],"unresolved_questions":["Which deployed writers and recovery traces use this protocol?"],"public_claims":[]},
    {"mechanism_id":"MECH-EVT-002","public_name":"cross-process sequence and provenance preservation","proposed_status":"experimental","maturity_ceiling":"M2_candidate","study_locator":"docs/local-mechanism-study-v0.md#mech-evt-002","proposed_evidence_kinds":["code","test","commit"],"pending_formal_fields":["inventory_item_ids","immutable_evidence","runtime_trace"],"known_drift_ids":["DRIFT-EVENT-001","DRIFT-STUB-BOUNDARY-001"],"unresolved_questions":["Which raw-port producers exist in the sealed runtime?"],"public_claims":[]},
    {"mechanism_id":"MECH-COMMIT-001","public_name":"envelope-to-gate commit or rejection","proposed_status":"experimental","maturity_ceiling":"M2_candidate","study_locator":"docs/local-mechanism-study-v0.md#mech-commit-001","proposed_evidence_kinds":["code","test","commit"],"pending_formal_fields":["inventory_item_ids","immutable_evidence","runtime_trace"],"known_drift_ids":[],"unresolved_questions":["Which checks are active for real commits?"],"public_claims":[]},
    {"mechanism_id":"MECH-PROJ-001","public_name":"replayable projections and watermarks","proposed_status":"experimental","maturity_ceiling":"M2_candidate","study_locator":"docs/local-mechanism-study-v0.md#mech-proj-001","proposed_evidence_kinds":["code","test","commit"],"pending_formal_fields":["inventory_item_ids","immutable_evidence","runtime_trace"],"known_drift_ids":["DRIFT-PROJECTION-CONTRACT-001"],"unresolved_questions":["Which reducers and consumers are complete in runtime?"],"public_claims":[]},
    {"mechanism_id":"M-ORCH-READYSET-EVENT-FANOUT","public_name":"event-sourced ready-set fan-out","proposed_status":"experimental","maturity_ceiling":"M2_candidate","study_locator":"docs/local-mechanism-study-v0.md#m-orch-readyset-event-fanout","proposed_evidence_kinds":["code","test","commit"],"pending_formal_fields":["inventory_item_ids","immutable_evidence","runtime_trace"],"known_drift_ids":["DRIFT-PRIVATE-RUNTIME-001","DRIFT-RUNTIME-MOCK-001"],"unresolved_questions":["Which daemon drives this path in production?"],"public_claims":[]},
    {"mechanism_id":"M-ORCH-SINGLE-EXEC-CLAIM-FENCING","public_name":"per-key spawn claim fencing","proposed_status":"experimental","maturity_ceiling":"M2_candidate","study_locator":"docs/local-mechanism-study-v0.md#m-orch-single-exec-claim-fencing","proposed_evidence_kinds":["code","test","commit"],"pending_formal_fields":["inventory_item_ids","immutable_evidence","runtime_trace"],"known_drift_ids":[],"unresolved_questions":["Do all dispatch paths use the same fence?"],"public_claims":[]},
    {"mechanism_id":"M-ORCH-WATERMARK-BACKLOG-DECOUPLING","public_name":"capacity-safe watermark advance","proposed_status":"experimental","maturity_ceiling":"M2_candidate","study_locator":"docs/local-mechanism-study-v0.md#m-orch-watermark-backlog-decoupling","proposed_evidence_kinds":["code","test","commit"],"pending_formal_fields":["inventory_item_ids","immutable_evidence","runtime_trace"],"known_drift_ids":[],"unresolved_questions":["What real backlog and capacity evidence exists?"],"public_claims":[]},
    {"mechanism_id":"M-REFLOW-OUT-OF-BAND-RECONCILIATION","public_name":"stranded-worktree reconciliation","proposed_status":"experimental","maturity_ceiling":"M2_candidate","study_locator":"docs/local-mechanism-study-v0.md#m-reflow-out-of-band-reconciliation","proposed_evidence_kinds":["code","test","commit"],"pending_formal_fields":["inventory_item_ids","immutable_evidence","runtime_trace"],"known_drift_ids":["DRIFT-DORMANT-AUTOREPAIR-001"],"unresolved_questions":["Is the sentinel enabled and receiving real inventory?"],"public_claims":[]},
    {"mechanism_id":"M-SESSION-LIVENESS-AND-DEADLETTER","public_name":"conservative liveness and dead-letter terminalization","proposed_status":"experimental","maturity_ceiling":"M2_candidate","study_locator":"docs/local-mechanism-study-v0.md#m-session-liveness-and-deadletter","proposed_evidence_kinds":["code","test","commit"],"pending_formal_fields":["inventory_item_ids","immutable_evidence","runtime_trace"],"known_drift_ids":["DRIFT-TEST-RUNTIME-003"],"unresolved_questions":["Is automatic revive live or deliberately dormant?"],"public_claims":[]},
    {"mechanism_id":"MECH-REVIEW-001","public_name":"event-folded review finding lifecycle","proposed_status":"experimental","maturity_ceiling":"M2_candidate","study_locator":"docs/local-mechanism-study-v0.md#mech-review-001","proposed_evidence_kinds":["code","test","commit"],"pending_formal_fields":["inventory_item_ids","immutable_evidence","runtime_trace"],"known_drift_ids":[],"unresolved_questions":["How do multi-session chains resolve in server evidence?"],"public_claims":[]},
    {"mechanism_id":"MECH-CLOSURE-001","public_name":"contract-side closure recomputation","proposed_status":"experimental","maturity_ceiling":"M2_candidate","study_locator":"docs/local-mechanism-study-v0.md#mech-closure-001","proposed_evidence_kinds":["code","test","commit"],"pending_formal_fields":["inventory_item_ids","immutable_evidence","runtime_trace"],"known_drift_ids":["DRIFT-DOC-CODE-005"],"unresolved_questions":["Why does the narrowed integration case disagree with the closure expectation?"],"public_claims":[]},
    {"mechanism_id":"MECH-CAPSULE-001","public_name":"provenance-bound capsule context","proposed_status":"experimental","maturity_ceiling":"M2_candidate","study_locator":"docs/local-mechanism-study-v0.md#mech-capsule-001","proposed_evidence_kinds":["code","test","commit"],"pending_formal_fields":["inventory_item_ids","immutable_evidence","runtime_trace"],"known_drift_ids":[],"unresolved_questions":["Which live prompt consumer receives a capsule?"],"public_claims":[]},
    {"mechanism_id":"MECH-PROV-001","public_name":"forward provenance anchor","proposed_status":"experimental","maturity_ceiling":"M2_candidate","study_locator":"docs/local-mechanism-study-v0.md#mech-prov-001","proposed_evidence_kinds":["code","test","commit"],"pending_formal_fields":["inventory_item_ids","immutable_evidence","runtime_trace"],"known_drift_ids":[],"unresolved_questions":["Which production writers create and consume anchors?"],"public_claims":[]},
    {"mechanism_id":"MECH-VERIFY-001","public_name":"independent verification fork","proposed_status":"experimental","maturity_ceiling":"M2_candidate","study_locator":"docs/local-mechanism-study-v0.md#mech-verify-001","proposed_evidence_kinds":["code","test","commit"],"pending_formal_fields":["inventory_item_ids","immutable_evidence","runtime_trace"],"known_drift_ids":["UNKNOWN-PHYSICAL-GATE-WIRING-001"],"unresolved_questions":["What physical isolation is actually enforced by the server sandbox?"],"public_claims":[]},
    {"mechanism_id":"MECH-OWNER-001","public_name":"owner-answer reflow","proposed_status":"experimental","maturity_ceiling":"M2_candidate","study_locator":"docs/local-mechanism-study-v0.md#mech-owner-001","proposed_evidence_kinds":["code","test","commit"],"pending_formal_fields":["inventory_item_ids","immutable_evidence","runtime_trace"],"known_drift_ids":["DRIFT-PRIVATE-RUNTIME-002"],"unresolved_questions":["Can a server trace prove PTY delivery and canonical answer events?"],"public_claims":[]}
  ],
  "unknowns": [
    {"unknown_id":"UNKNOWN-SERVER-RUNTIME-001","question":"Which mechanisms, daemons, units and workload paths are live on the server? A read-only metadata observation reports one clean source-export commit/tree but canonical origin and any binding to an instantiated runtime remain unknown. The later negative field-availability precheck (`registries/runtime-field-availability-probe-v0.json`) found no compliant chain class in its declared key-only scope; it neither establishes absence of runtime nor narrows this blocker into a runtime claim.","blocking":true,"next_check":"A trusted vault collector must freeze one existing trace's exact internal locator, record/byte range and field allowlist, then produce a redacted Evidence Seal with independently verified deployed identity plus producer, event/sentinel, projection/watermark, consumer, failure/recovery and postcondition records"},
    {"unknown_id":"UNKNOWN-PUBLIC-API-001","question":"Is there a versioned public API or SDK contract beyond the dashboard HTTP server?","blocking":true,"next_check":"sealed interface inventory"},
    {"unknown_id":"UNKNOWN-HOOK-LIVENESS-001","question":"Which hooks are installed and firing on real devices?","blocking":true,"next_check":"redacted runtime hook evidence"},
    {"unknown_id":"UNKNOWN-WOW-CONTINUITY-001","question":"What legacy Wow-Harness tag, remote, issues and PR continuity is available?","blocking":true,"next_check":"owner-approved GitHub/repository audit"}
  ],
  "drift_refs": ["DRIFT-OSS-CLI-001","DRIFT-OSS-CONTROL-002","DRIFT-PRIVATE-RUNTIME-001","DRIFT-PRIVATE-RUNTIME-002","DRIFT-EVENT-001","DRIFT-TEST-RUNTIME-003","DRIFT-PUBLIC-EXPORT-004","DRIFT-DOC-CODE-005","DRIFT-EVENT-COUNT-001","DRIFT-STUB-BOUNDARY-001","DRIFT-RUNTIME-MOCK-001","UNKNOWN-PHYSICAL-GATE-WIRING-001","DRIFT-DAEMON-STATUS-001","DRIFT-DORMANT-AUTOREPAIR-001","DRIFT-PROJECTION-CONTRACT-001","DRIFT-CONFIG-PROVENANCE-001","DRIFT-PUBLIC-CORE-INSTALL-001"]
}
